{
  "runtime": {
    "type": "node",
    "version": "20"
  },
  "init": {
    "darwin": "npm install -g your-cli",
    "linux": "npm install -g your-cli",
    "win32": "npm install -g your-cli"
  },
  "auth": {
    "darwin": "your-cli auth login",
    "linux": "your-cli auth login",
    "win32": "your-cli.cmd auth login"
  },
  "unAuth": {
    "darwin": "your-cli auth logout",
    "linux": "your-cli auth logout",
    "win32": "your-cli.cmd auth logout"
  },
  "status": {
    "darwin": "your-cli auth status",
    "linux": "your-cli auth status",
    "win32": "your-cli.cmd auth status"
  },
  "statusMatch": "Logged in",
  "authUrlDomain": "example.com"
}
